run_id	git_commit	git_parent_commit	description	status	decision_reason	samples	epochs	joint_answer_or_abstain_acc	abstain_accuracy	abstain_precision	abstain_recall	raw_recall_at_k	latest_slice_recall	latest_slice_conflict_accuracy	regime_mismatch	time_bucket_mismatch	attribute_mismatch	wrong_answer_should_abstain	wrong_answer_should_answer	false_abstain	false_merge_rate	unnecessary_branch_rate	header_fake_fact_rate	avg_header_value_purity	avg_headers_used	avg_retrieval_latency_ms	hard_joint_answer_or_abstain_acc	hard_abstain_accuracy	hard_abstain_precision	hard_abstain_recall	hard_raw_recall_at_k	hard_latest_slice_recall	hard_latest_slice_conflict_accuracy	hard_regime_mismatch	hard_time_bucket_mismatch	hard_attribute_mismatch	hard_wrong_answer_should_abstain	hard_wrong_answer_should_answer	hard_false_abstain	hard_false_merge_rate	hard_unnecessary_branch_rate	hard_header_fake_fact_rate	hard_avg_header_value_purity	hard_avg_headers_used	hard_avg_retrieval_latency_ms	locomo_report_path	locomo_query_count	locomo_joint_answer_or_abstain_acc	locomo_abstain_precision	locomo_abstain_recall	locomo_answer_match_rate	locomo_answer_evidence_recall	locomo_current_joint_acc	locomo_temporal_joint_acc	locomo_multi_hop_joint_acc	locomo_abstain_like_acc	locomo_failure_temporal_selection_error	locomo_failure_missing_evidence	locomo_failure_false_abstain	locomo_failure_multi_hop_failure	locomo_failure_attribute_mismatch	locomo_failure_entity_mismatch
20260317-074552			ucmd_v36_baseline			1000	8	1.000000	1.000000	1.000000	1.000000	1.000000	1.000000	1.000000							0.229917	0.128585	1.000000	0.374717	4.000	12.792																																				
20260317-075521			ucmd_v36_baseline			1000	8	1.000000	1.000000	1.000000	1.000000	1.000000	1.000000	1.000000							0.229917	0.128585	1.000000	0.374717	4.000	11.065																																				
20260317-100349	4b44c8f26e2c0546dc460ffdb74f88ff1eb202cf	2f6af9307d564e38b213320e0f22836dc2644271	repair the locked run loop return path and add a LoCoMo observation-memory-QA adapter with generated locomo_adapted outputs	keep	no prior keep row in the locked ledger; establishing the first reference candidate	1000	8	1.000000	1.000000	1.000000	1.000000	1.000000	1.000000	1.000000	0	0	0	0	0	0	0.229917	0.128585	1.000000	0.374717	4.000	11.859	1.000000	1.000000	1.000000	1.000000	0.833333	1.000000	1.000000	0	0	0	0	0	0	0.282222	0.147287	1.000000	0.340476	2.606	7.780																	
20260317-110214	d32b3a44f9862e22e0f976dba898988106cb5109	63f4312f835340d8b9305e7450c17384f7a14698	evaluate the leakage-free LoCoMo adapter as an external benchmark track against the frozen UCMD V3.6 baseline	keep	hard retrieval latency improved against keep run 20260317-100349	1000	8	1.000000	1.000000	1.000000	1.000000	1.000000	1.000000	1.000000	0	0	0	0	0	0	0.229917	0.128585	1.000000	0.374717	4.000	11.445	1.000000	1.000000	1.000000	1.000000	0.833333	1.000000	1.000000	0	0	0	0	0	0	0.282222	0.147287	1.000000	0.340476	2.606	7.687																	
20260317-121137	97da00918f04a94ac5359f5b0a6aae9806862b30	d32b3a44f9862e22e0f976dba898988106cb5109	add the first official LoCoMo eval-only reference track with headline ledger metrics, benchmark reports, runbook updates, and a query-entity adapter fix	keep	hard retrieval latency improved against keep run 20260317-110214	1000	8	1.000000	1.000000	1.000000	1.000000	1.000000	1.000000	1.000000	0	0	0	0	0	0	0.229917	0.128585	1.000000	0.374717	4.000	10.968	1.000000	1.000000	1.000000	1.000000	0.833333	1.000000	1.000000	0	0	0	0	0	0	0.282222	0.147287	1.000000	0.340476	2.606	7.229	locomo_adapted/eval/20260317-121137.md	1986	0.217019	0.252061	0.963964	0.001511	0.019637	0.004098	0.080000	0.006757	0.963964	236	0	1270	22	0	0
20260317-145422	406c6ebe13ad39b66e346197967849fbbe8be2cb	97da00918f04a94ac5359f5b0a6aae9806862b30	add the first locomo_mode_adapter package with policy-mode dispatch and separate current temporal multi-hop and abstain-like LoCoMo policies	discard	ties best keep run 20260317-121137 within tolerance; incumbent remains the reference	1000	8	1.000000	1.000000	1.000000	1.000000	1.000000	1.000000	1.000000	0	0	0	0	0	0	0.229917	0.128585	1.000000	0.374717	4.000	10.921	1.000000	1.000000	1.000000	1.000000	0.833333	1.000000	1.000000	0	0	0	0	0	0	0.282222	0.147287	1.000000	0.340476	2.606	7.466	locomo_adapted/eval/20260317-145422.md	1986	0.330312	0.804348	1.000000	0.106747	0.281974	0.036885	0.191111	0.180180	1.000000	318	0	108	806	256	0
